Name ;Altered documentation;Errors in software;Suspicious data modifications;Recently received updates;Recently used removable media;Likelihood Of Attack;Typical Severity;Denial of service;Suspicious code changes;Software in development phase;Software in deployment phase;Unauthenticated physical access recently;Type;Description;Mitigations;
Configuration Environment Manipulation ;false;false;false;false;false;Medium;Medium ;false;false;false;false;false;both;An attacker manipulates files or settings external to a target application which affect the behavior of that application. For example, many applications use external configuration files and libraries - modification of these entities or otherwise affecting the application's ability to use them would constitute a configuration/environment manipulation attack.;undefined;
Modification During Manufacture ;false;false;false;false;false;Low;Medium;false;false;false;false;false;both;An attacker modifies a technology, product, or component during a stage in its manufacture for the purpose of carrying out an attack against some entity involved in the supply chain lifecycle. There are an almost limitless number of ways an attacker can modify a technology when they are involved in its manufacture, as the attacker has potential inroads to the software composition, hardware design and assembly, firmware, or basic design mechanics. Additionally, manufacturing of key components is often outsourced with the final product assembled by the primary manufacturer. The greatest risk, however, is deliberate manipulation of design specifications to produce malicious hardware or devices. There are billions of transistors in a single integrated circuit and studies have shown that fewer than 10 transistors are required to create malicious functionality.;undefined;
Manipulation During Distribution ;false;false;false;false;false;High;High;false;false;false;false;false;hardware;An attacker undermines the integrity of a product, software, or technology at some stage of the distribution channel. The core threat of modification or manipulation during distribution arise from the many stages of distribution, as a product may traverse multiple suppliers and integrators as the final asset is delivered. Components and services provided from a manufacturer to a supplier may be tampered with during integration or packaging.;undefined;
Hardware Integrity Attack ;false;false;false;false;false;Low ;High ;false;false;false;false;true;hardware;An adversary exploits a weakness in the system maintenance process and causes a change to be made to a technology, product, component, or sub-component or a new one installed during its deployed use at the victim location for the purpose of carrying out an attack.;undefined;
Malicious Logic Insertion ;false;false;false;false;false;Medium ;High ;false;false;false;false;false;both;An adversary installs or adds malicious logic (also known as malware) into a seemingly benign component of a fielded system. This logic is often hidden from the user of the system and works behind the scenes to achieve negative impacts. With the proliferation of mass digital storage and inexpensive multimedia devices, Bluetooth and 802.11 support, new attack vectors for spreading malware are emerging for things we once thought of as innocuous greeting cards, picture frames, or digital projectors. This pattern of attack focuses on systems already fielded and used in operation as opposed to systems and their components that are still under development and part of the supply chain.;undefined;
Manipulate Registry Information ;false;false;false;false;false;Low;Medium ;false;false;false;false;false;software;An adversary exploits a weakness in authorization in order to modify content within a registry (e.g., Windows Registry, Mac plist, application registry). Editing registry information can permit the adversary to hide configuration information or remove indicators of compromise to cover up activity. Many applications utilize registries to store configuration and service information. As such, modification of registry information can affect individual services (affecting billing, authorization, or even allowing for identity spoofing) or the overall configuration of a targeted application. For example, both Java RMI and SOAP use registries to track available services. Changing registry values is sometimes a preliminary step towards completing another attack pattern, but given the long term usage of many registry values, manipulation of registry information could be its own end.;::Ensure proper permissions are set for Registry hives to prevent users from modifying keys.::Employ a robust and layered defensive posture in order to prevent unauthorized users on your system.::Employ robust identification and audit/blocking using an allowlist of applications on your system. Unnecessary applications, utilities, and configurations will have a presence in the system registry that can be leveraged by an adversary through this attack pattern.::;
Schema Poisoning ;false;true;false;false;false;Low ;High ;true;false;false;false;false;software;An adversary corrupts or modifies the content of a schema for the purpose of undermining the security of the target. Schemas provide the structure and content definitions for resources used by an application. By replacing or modifying a schema, the adversary can affect how the application handles or interprets a resource, often leading to possible denial of service, entering into an unexpected state, or recording incomplete data.;::Design: Protect the schema against unauthorized modification.::Implementation: For applications that use a known schema, use a local copy or a known good repository instead of the schema reference supplied in the schema document.::Implementation: For applications that leverage remote schemas, use the HTTPS protocol to prevent modification of traffic in transit and to avoid unauthorized modification.:: ;
Data Injected During Configuration ;false;false;false;false;false;Low ;High ;false;ture;false;false;false;software;An attacker with access to data files and processes on a victim's system injects malicious data into critical operational data during configuration or recalibration, causing the victim's system to perform in a suboptimal manner that benefits the adversary. ;::Ensure that proper access control is implemented on all systems to prevent unauthorized access to system files and processes.:: ;
Disable Security Software ;false;false;false;false;false;Medium ;Medium ;false;false;false;false;false;software;An adversary exploits a weakness in access control to disable security tools so that detection does not occur. This can take the form of killing processes, deleting registry keys so that tools do not start at run time, deleting log files, or other methods. ;::Ensure proper permissions are in place to prevent adversaries from altering the execution status of security tools.:: ;
Manipulating Writeable Configuration Files ;false;false;false;false;false;High ;Very High ;false;true;true;true;false;software;Generally these are manually edited files that are not in the preview of the system administrators, any ability on the attackers' behalf to modify these files, for example in a CVS repository, gives unauthorized access directly to the application, the same as authorized users. ;::Design: Enforce principle of least privilege::Design: Backup copies of all configuration files::Implementation: Integrity monitoring for configuration files::Implementation: Enforce audit logging on code and configuration promotion procedures.::Implementation: Load configuration from separate process and memory space, for example a separate physical device like a CD:: ;
Modification of Registry Run Keys ;false;false;false;false;false;Medium ;Medium ;false;false;false;false;false;software;An adversary adds a new entry to the run keys in the registry so that an application of their choosing is executed when a user logs in. In this way, the adversary can get their executable to operate and run on the target system with the authorized user's level of permissions. ;::Identify programs that may be used to acquire process information and block them by using a software restriction policy or tools that restrict program execution by using a process allowlist.:: ;
Modification of Windows Service Configuration ;false;false;false;false;false;Low ;High ;false;false;false;false;false;software;An adversary exploits a weakness in access control to modify the execution parameters of a Windows service. Specifically, if the permissions for users and groups are not properly assigned and allow access to the registry keys used to store the configuration information for a service, then an adversary could change settings defining the path to the executable and cause a malicious binary to be executed. ;::Ensure proper permissions are set for Registry hives to prevent users from modifying keys for system components that may lead to privilege escalation.::;
XML Schema Poisoning ;false;false;false;false;false;Low ;High ;false;false;false;false;false;software;An adversary corrupts or modifies the content of XML schema information passed between a client and server for the purpose of undermining the security of the target. XML Schemas provide the structure and content definitions for XML documents. Schema poisoning is the ability to manipulate a schema either by replacing or modifying it to compromise the programs that process documents that use this schema. Possible attacks are denial of service attacks by modifying the schema so that it does not contain required information for subsequent processing. For example, the unaltered schema may require a @name attribute in all submitted documents. If the adversary removes this attribute from the schema then documents created using the new grammar may lack this field, which may cause the processing application to enter an unexpected state or record incomplete data. In addition, manipulation of the data types described in the schema may affect the results of calculations taken by the document reader. For example, a float field could be changed to an int field. Finally, the adversary may change the encoding defined in the schema for certain fields allowing the contents to bypass filters that scan for dangerous strings. For example, the modified schema might use a URL encoding instead of ASCII, and a filter that catches a semicolon  might fail to detect its URL encoding (%3B).;::Design: Protect the schema against unauthorized modification.::Implementation: For applications that use a known schema, use a local copy or a known good repository instead of the schema reference supplied in the XML document. Additionally, ensure that the proper permissions are set on local files to avoid unauthorized modification.::Implementation: For applications that leverage remote schemas, use the HTTPS protocol to prevent modification of traffic in transit and to avoid unauthorized modification.:: ;
Development Alteration ;false;false;false;false;false;Medium ;High ;false;false;false;false;false;software;An adversary modifies a technology, product, or component during its development to acheive a negative impact once the system is deployed. The goal of the adversary is to modify the system in such a way that the negative impact can be leveraged when the system is later deployed. Development alteration attacks may include attacks that insert malicious logic into the system's software, modify or replace hardware components, and other attacks which negatively impact the system during development. These attacks generally require insider access to modify source code or to tamper with hardware components. The product is then delivered to the user where the negative impact can be leveraged at a later time.;::Assess software and software components during development and prior to deployment to ensure that they function as intended and without any malicious functionality.::;
Design Alteration ;false;false;false;false;false;Medium ;High ;false;false;false;false;false;software;An adversary modifies the design of a technology, product, or component to acheive a negative impact once the system is deployed. In this type of attack, the goal of the adversary is to modify the design of the system, prior to development starting, in such a way that the negative impact can be leveraged when the system is later deployed. Design alteration attacks differ from development alteration attacks in that design alteration attacks take place prior to development and which then may or may not be developed by the adverary. Design alteration attacks include modifying system designs to degrade system performance, cause unexpected states or errors, and general design changes that may lead to additional vulnerabilities. These attacks generally require insider access to modify design documents, but they may also be spoofed via web communications. The product is then developed and delivered to the user where the negative impact can be leveraged at a later time.;::Assess design documentation prior to development to ensure that they function as intended and without any malicious functionality.::Ensure that design documentation is saved in a secure location and has proper access controls set in place to avoid unnecessary modification.::;
Malicious Logic Insertion into Product Software via Configuration Management Manipulation ;false;false;false;false;false;Medium ;High ;false;false;true;true;false;software;An adversary exploits a configuration management system so that malicious logic is inserted into a software products build, update or deployed environment. If an adversary can control the elements included in a product's configuration management for build they can potentially replace, modify or insert code files containing malicious logic. If an adversary can control elements of a product's ongoing operational configuration management baseline they can potentially force clients receiving updates from the system to install insecure software when receiving updates from the server. Configuration management servers operate on the basis of a client pool, instructing each client on which software to install. In some cases the configuration management server will automate the software installation process. A malicious insider or an adversary who has compromised the server can alter the software baseline that clients must install, allowing the adversary to compromise a large number of satellite machines using the configuration management system. If an adversary can control elements of a product's configuration management for its deployed environment they can potentially alter fundamental security properties of the system based on assumptions that secure configurations are in place.;::Assess software during development and prior to deployment to ensure that it functions as intended and without any malicious functionality.::Leverage anti-virus products to detect and quarantine software with known virus.::;
Malicious Logic Inserted Into Product Software by Authorized Developer ;false;false;false;false;false;Medium ;High ;false;false;true;true;false;software;An adversary uses their privileged position within an authorized software development organization to inject malicious logic into a codebase or product. Supply chain attacks from approved or trusted developers are extremely difficult to detect as it is generally assumed the quality control and internal security measures of these organizations conform to best practices. In some cases the malicious logic is intentional, embedded by a disgruntled employee, programmer, or individual with an otherwise hidden agenda. In other cases, the integrity of the product is compromised by accident (e.g. by lapse in the internal security of the organization that results in a product becoming contaminated). In other cases, the developer embeds a backdoor into a product to serve some purpose, such as product support, but discovery of the backdoor results in its malicious use by adversaries.;::Assess software during development and prior to deployment to ensure that it functions as intended and without any malicious functionality.::;
Malicious Logic Insertion into Product Software via Inclusion of 3rd Party Component Dependency ;false;false;false;false;false;Medium ;High ;false;false;true;true;false;software;An adversary conducts supply chain attacks by the inclusion of insecure 3rd party components into a technology, product, or code-base, possibly packaging a malicious driver or component along with the product before shipping it to the consumer or acquirer. The result is a window of opportunity for exploiting the product or software until the insecure component is discovered. This supply chain threat can result in the installation of software that introduces widespread security vulnerabilities within an organization. One example could be the inclusion of an exploitable DLL (Dynamic Link Library) included within an antivirus technology. Because software often depends upon a large number of interdependent libraries and components to be present, security holes can be introduced merely by installing COTS software that comes pre-packaged with the components required for it to operate.;::Assess software during development and prior to deployment to ensure that it functions as intended and without any malicious functionality.::;
Infiltration of Software Development Environment ;false;false;false;true;false;Low ;High ;false;false;true;true;true;software;An attacker uses common delivery mechanisms such as email attachments or removable media to infiltrate the IDE (Integrated Development Environment) of a victim manufacturer with the intent of implanting malware allowing for attack control of the victim IDE environment. The attack then uses this access to exfiltrate sensitive data or information, manipulate said data or information, and conceal these actions. This will allow and aid the attack to meet the goal of future compromise of a recipient of the victim's manufactured product further down in the supply chain.;undefined;
Hardware Component Substitution During Baselining ;false;false;false;false;false;Low ;High ;false;false;false;false;true;hardware;An attacker with access to system components during allocated baseline development can substitute a maliciously altered hardware component for a baseline component in the during the product development and research phase. This can lead to adjustments and calibrations being made in the product, so that when the final product with the proper components is deployed, it will not perform as designed and be advantageous to the attacker.;undefined;
Counterfeit Hardware Component Inserted During Product Assembly ;false;false;false;false;false;Low ;High ;false;false;false;false;false;hardware;An attacker with either direct access to the product assembly process or to the supply of subcomponents used in the product assembly process introduces counterfeit hardware components into product assembly. The assembly containing the counterfeit components results in a system specifically designed for malicious purposes.;undefined;
Altered Installed BIOS ;false;false;false;true;false;Low ;High ;false;false;false;false;false;software;An attacker with access to download and update system software sends a maliciously altered BIOS to the victim or victim supplier/integrator, which when installed allows for future exploitation.;undefined;
Infiltration of Hardware Development Environment ;false;false;false;false;false;Low ;High ;false;false;false;false;true;hardware;An attacker, leveraging the ability to manipulate components of primary support systems and tools within the development and production environments, inserts malicious software within the hardware and/or firmware development environment. The infiltration purpose is to alter developed hardware components in a system destined for deployment at the victim's organization, for the purpose of disruption or further compromise.;undefined;
Open Source Libraries Altered ;false;false;false;false;false;Low ;High ;false;false;true;true;false;software;An attacker with access to an open source code project (OSS) and knowledge of its particular use for in a system being developed, manufactured, or supported for the victim, can insert malicious code into the open source software used for math libraries in anticipation of inclusion into the system for the purpose of disruption or further compromise within the victim organization.;undefined;
ASIC With Malicious Functionality ;false;false;false;false;false;Low ;High ;false;false;true;false;false;hardware;An attacker with access to the development environment process of an application-specific integrated circuit (ASIC) for a victim system being developed or maintained after initial deployment can insert malicious functionality into the system for the purpose of disruption or further compromise.;undefined;
Documentation Alteration to Circumvent Dial Down ;true;true;false;false;false;Low ;High ;false;false;false;false;false;software;An attacker with access to a manufacturer's documentation, which include descriptions of advanced technology and/or specific components' criticality, alters the documents to circumvent dial-down functionality requirements. This alteration would change the interpretation of implementation and manufacturing techniques, allowing for advanced technologies to remain in place even though these technologies might be restricted to certain customers, such as nations on the terrorist watch list, giving the attacker on the receiving end of a shipped product access to an advanced technology that might otherwise be restricted.;undefined;
Documentation Alteration to Produce Under Performing Systems ;true;true;false;false;false;Low ;High ;false;false;false;false;false;software;An attacker with access to a manufacturer's documentation alters the descriptions of system capabilities with the intent of causing errors in derived system requirements, impacting the overall effectiveness and capability of the system, allowing an attacker to take advantage of the introduced system capability flaw once the system is deployed.;undefined;
Documentation Alteration to Cause Errors in System Design ;true;true;false;false;false;Low ;High ;false;false;false;false;false;software;An attacker with access to a manufacturer's documentation containing requirements allocation and software design processes maliciously alters the documentation in order to cause errors in system design. This allows the attacker to take advantage of a weakness in a deployed system of the manufacturer for malicious purposes.;undefined;
Hardware Design Specifications Are Altered ;false;false;false;false;false;Low ;High ;false;false;false;false;true;hardware;An attacker with access to a manufacturer's hardware manufacturing process documentation alters the design specifications, which introduces flaws advantageous to the attacker once the system is deployed.;undefined;
Malicious Hardware Component Replacement ;false;false;false;false;false;Low ;High ;false;true;false;false;true;hardware;An attacker replaces legitimate hardware in the system with faulty counterfeit or tampered hardware in the supply chain distribution channel, with purpose of causing malicious disruption or allowing for additional compromise when the system is deployed.;undefined;
Malicious Software Implanted ;false;false;false;false;false;Low ;High ;false;true;false;false;true;software;An attacker implants malicious software into the system in the supply chain distribution channel, with purpose of causing malicious disruption or allowing for additional compromise when the system is deployed.;undefined;
Rogue Integration Procedures ;false;false;false;false;false;Low ;High ;false;false;true;false;true;both;An attacker alters or establishes rogue processes in an integration facility in order to insert maliciously altered components into the system. The attacker would then supply the malicious components. This would allow for malicious disruption or additional compromise when the system is deployed.;undefined;
Physically Hacking Hardware ;false;false;false;false;false;Low ;High ;false;false;false;false;true;hardware;An adversary exploits a weakness in access control to gain access to currently installed hardware and precedes to implement changes or secretly replace a hardware component which undermines the system's integrity for the purpose of carrying out an attack.;undefined;
Bypassing ATA Password Security ;false;false;false;false;false;Low;Low;false;false;false;false;true;hardware;An attacker exploits a weakness in ATA security on a drive to gain access to the information the drive contains without supplying the proper credentials. ATA Security is often employed to protect hard disk information from unauthorized access. The mechanism requires the user to type in a password before the BIOS is allowed access to drive contents. Some implementations of ATA security will accept the ATA command to update the password without the user having authenticated with the BIOS. This occurs because the security mechanism assumes the user has first authenticated via the BIOS prior to sending commands to the drive. Various methods exist for exploiting this flaw, the most common being installing the ATA protected drive into a system lacking ATA security features (a.k.a. hot swapping). Once the drive is installed into the new system the BIOS can be used to reset the drive password.;undefined;
