Malicious Hardware Update ;false;false;false;false;false;Low ;High ;false;false;false;false;false;hardware;An adversary introduces malicious hardware during an update or replacement procedure, allowing for additional compromise or site disruption at the victim location. After deployment, it is not uncommon for upgrades and replacements to occur involving hardware and various replaceable parts. These upgrades and replacements are intended to correct defects, provide additional features, and to replace broken or worn-out parts. However, by forcing or tricking the replacement of a good component with a defective or corrupted component, an adversary can leverage known defects to obtain a desired malicious impact.;undefined;
Hardware Component Substitution ;false;false;false;false;false;Low ;High ;false;false;false;false;true;hardware;An attacker substitutes out a tested and approved hardware component for a maliciously-altered hardware component. This type of attack is carried out directly on the system, enabling the attacker to then cause disruption or additional compromise.;undefined;
Infected Software ;false;false;false;false;true;Medium ;High ;false;false;false;false;false;software;An adversary adds malicious logic, often in the form of a computer virus, to otherwise benign software. This logic is often hidden from the user of the software and works behind the scenes to achieve negative impacts. Many times, the malicious logic is inserted into empty space between legitimate code, and is then called when the software is executed. This pattern of attack focuses on software already fielded and used in operation as opposed to software that is still under development and part of the supply chain.;::Leverage anti-virus products to detect and quarantine software with known virus.::;
Infected Hardware ;false;false;false;false;true;Medium ;High ;false;false;false;false;true;hardware;An adversary inserts malicious logic into hardware, typically in the form of a computer virus or rootkit. This logic is often hidden from the user of the hardware and works behind the scenes to achieve negative impacts. This pattern of attack focuses on hardware already fielded and used in operation as opposed to hardware that is still under development and part of the supply chain.;undefined;
Infected Memory ;false;false;false;false;true;Medium ;High ;false;false;false;false;true;hardware;An adversary inserts malicious logic into memory enabling them to achieve a negative impact. This logic is often hidden from the user of the system and works behind the scenes to achieve negative impacts. This pattern of attack focuses on systems already fielded and used in operation as opposed to systems that are still under development and part of the supply chain.;::Leverage anti-virus products to detect stop operations with known virus.::;
Embed Virus into DLL ;false;false;true;false;true;Medium ;High ;false;false;false;true;false;software;An adversary tampers with a DLL and embeds a computer virus into gaps between legitimate machine instructions. These gaps may be the result of compiler optimizations that pad memory blocks for performance gains. The embedded virus then attempts to infect any machine which interfaces with the product, and possibly steal private data or eavesdrop.;::Leverage anti-virus products to detect and quarantine software with known virus.::;
Altered Component Firmware ;false;false;false;true;false;Low ;High ;false;false;false;false;false;software;An adversary with access to download and update system software sends a maliciously altered BIOS to the victim or victim supplier/integrator, which when installed allows for future exploitation.;undefined;
USB Memory Attacks ;false;false;true;false;true;Low ;High ;false;false;false;false;true;hardware;An adversary loads malicious code onto a USB memory stick in order to infect any system which the device is plugged in to. USB drives present a significant security risk for business and government agencies. Given the ability to integrate wireless functionality into a USB stick, it is possible to design malware that not only steals confidential data, but sniffs the network, or monitor keystrokes, and then exfiltrates the stolen data off-site via a Wireless connection. Also, viruses can be transmitted via the USB interface without the specific use of a memory stick. The attacks from USB devices are often of such sophistication that experts conclude they are not the work of single individuals, but suggest state sponsorship. These attacks can be performed by an adversary with direct access to a target system or can be executed via means such as USB Drop Attacks.;::Ensure that proper, physical system access is regulated to prevent an adversary from physically connecting a malicious USB device themself.::Use anti-virus and anti-malware tools which can prevent malware from executing if it finds its way onto a target system. Additionally, make sure these tools are regularly updated to contain up-to-date virus and malware signatures.::Do not connect untrusted USB devices to systems connected on an organizational network. Additionally, use an isolated testing machine to validate untrusted devices and confirm malware does not exist.::;
Flash Memory Attacks ;false;false;false;false;true;Low;Low;false;false;false;false;false;hardware;An attacker inserts malicious logic into a product or technology via flashing the on-board memory with a code-base that contains malicious logic. Various attacks exist against the integrity of flash memory, the most direct being rootkits coded into the BIOS or chipset of a device. Such attacks are very difficult to detect because the malicious code resides outside the filesystem or RAM, and in the underlying byte-code that drives the processor. Many devices, such as the recent attacks against digital picture frames, contain only a microprocessor and a small amount of solid-state memory, rendering these devices ideal for flash based malware or malicious logic. One of the pernicious characteristics of flash memory based attacks is that the malicious code can survive even a total format of the hard-drive and reinstallation of the host operating system. Virtually any device which can be integrated into a computer system is susceptible to these attacks. Additionally, any peripheral device which interfaces with the computer bus could extract or sniff confidential data, even on systems employing full-disk encryption. Trojan code placed into a video card's chipset would continue to perform its function irrespective of the host operating system, and would be invisible to all known antivirus. The threats extend to consumer products such as camcorders, digital cameras, or any consumer electronic device with an embedded microcontroller.;undefined;
Poison Web Service Registry ;false;false;false;false;false;High ;Very High ;true;false;false;false;false;software;SOA and Web Services often use a registry to perform look up, get schema information, and metadata about services. A poisoned registry can redirect (think phishing for servers) the service requester to a malicious service provider, provide incorrect information in schema or metadata (to effect a denial of service), and delete information about service provider interfaces. WS-Addressing is used to virtualize services, provide return addresses and other routing information, however, unless the WS-Addressing headers are protected they are vulnerable to rewriting. The attacker that can rewrite WS-addressing information gains the ability to route service requesters to any service providers, and the ability to route service provider response to any service. Content in a registry is deployed by the service provider. The registry in an SOA or Web Services system can be accessed by the service requester via UDDI or other protocol. The basic flow for the attacker consists of either altering the data at rest in the registry or uploading malicious content by spoofing a service provider. The service requester is then redirected to send its requests and/or responses to services the attacker controls.;::Design: Enforce principle of least privilege::Design: Harden registry server and file access permissions::Implementation: Implement communications to and from the registry using secure protocols::;
